{
  "all_controls_pass": true,
  "claim_boundary": "readiness matrix only; not empirical and not a claim that future roadmap items are implemented",
  "columns": [
    "has_artifact",
    "has_schema",
    "has_validator",
    "has_negative_control",
    "manuscript_claim_allowed"
  ],
  "controls": {
    "all_future_blocked": true,
    "all_implemented_validated": true,
    "every_future_has_next_gate": true,
    "every_row_has_boundary": true,
    "every_row_has_negative_control": true,
    "forged_completed_future_row_rejected": true
  },
  "forged_completed_future_row_control": {
    "blocked_task_id": "re-3",
    "boundary": "physical qFEP realization remains roadmap only; not implemented, not empirical, and not a full qFEP result",
    "current_artifact": "",
    "current_schema": "",
    "current_validation_gate": "",
    "has_artifact": false,
    "has_negative_control": true,
    "has_schema": false,
    "has_validator": false,
    "id": "re-3",
    "manuscript_claim_allowed": false,
    "readiness_score": 0.0,
    "readiness_state": "implemented_finite_simulation",
    "required_negative_control": "finite Lindblad and many-body software surrogates must not be accepted as physical qFEP realization evidence",
    "required_next_artifact": "output/data/physical_qfep_realization_audit.json",
    "required_next_gate": "physical_qfep_realization_audit_ok",
    "roadmap_class": "future"
  },
  "future_count": 5,
  "implemented_count": 17,
  "row_count": 22,
  "rows": [
    {
      "boundary": "direct finite quantum-information calculation, not a universe-agent boundary simulation",
      "current_artifact": "output/data/quantum_boundary_entropy.json",
      "current_schema": "schemas/quantum_boundary_entropy.schema.json",
      "current_validation_gate": "quantum_boundary_entropy_ok",
      "has_artifact": true,
      "has_negative_control": true,
      "has_schema": true,
      "has_validator": true,
      "id": "two_qubit_separability_entropy",
      "manuscript_claim_allowed": true,
      "readiness_score": 1.0,
      "readiness_state": "validated_finite_simulation",
      "required_negative_control": "product endpoint must have zero reduced entropy while Bell endpoint has one bit",
      "required_next_artifact": "output/data/higher_dimensional_entanglement_audit.json",
      "required_next_gate": "higher_dimensional_entanglement_audit_ok",
      "roadmap_class": "implemented"
    },
    {
      "boundary": "finite mixed-state two-qubit PPT and negativity audit only, not a many-body boundary realization",
      "current_artifact": "output/data/arbitrary_two_qubit_entanglement_audit.json",
      "current_schema": "schemas/arbitrary_two_qubit_entanglement_audit.schema.json",
      "current_validation_gate": "arbitrary_two_qubit_entanglement_audit_ok",
      "has_artifact": true,
      "has_negative_control": true,
      "has_schema": true,
      "has_validator": true,
      "id": "arbitrary_two_qubit_entanglement_audit",
      "manuscript_claim_allowed": true,
      "readiness_score": 1.0,
      "readiness_state": "validated_finite_simulation",
      "required_negative_control": "invalid density matrices must be rejected and Werner threshold cases must match PPT/negativity expectations",
      "required_next_artifact": "output/data/multipartite_entanglement_witness_audit.json",
      "required_next_gate": "multipartite_entanglement_witness_audit_ok",
      "roadmap_class": "implemented"
    },
    {
      "boundary": "CHSH witness only; not a general proof of contextuality for the paper's full QRF setting",
      "current_artifact": "output/data/quantum_boundary_entropy.json",
      "current_schema": "schemas/quantum_boundary_entropy.schema.json",
      "current_validation_gate": "quantum_contextuality_witness_ok",
      "has_artifact": true,
      "has_negative_control": true,
      "has_schema": true,
      "has_validator": true,
      "id": "chsh_contextuality_witness",
      "manuscript_claim_allowed": true,
      "readiness_score": 1.0,
      "readiness_state": "validated_finite_simulation",
      "required_negative_control": "product endpoint remains CHSH-local while Bell endpoint reaches the Tsirelson value",
      "required_next_artifact": "output/data/contextuality_inequality_library_audit.json",
      "required_next_gate": "contextuality_inequality_library_audit_ok",
      "roadmap_class": "implemented"
    },
    {
      "boundary": "finite CHSH measurement-cover empirical model and local-polytope LP only; not a full sheaf-contextuality engine or QRF transformation library",
      "current_artifact": "output/data/quantum_measurement_contextuality.json",
      "current_schema": "schemas/quantum_measurement_contextuality.schema.json",
      "current_validation_gate": "quantum_measurement_contextuality_ok",
      "has_artifact": true,
      "has_negative_control": true,
      "has_schema": true,
      "has_validator": true,
      "id": "chsh_measurement_cover_table",
      "manuscript_claim_allowed": true,
      "readiness_score": 1.0,
      "readiness_state": "validated_finite_simulation",
      "required_negative_control": "product-control cover fits the local polytope while Bell cover is infeasible",
      "required_next_artifact": "output/data/disturbance_aware_measurement_cover_audit.json",
      "required_next_gate": "disturbance_aware_measurement_cover_audit_ok",
      "roadmap_class": "implemented"
    },
    {
      "boundary": "finite deterministic-assignment LP audit over parsed covers only, not empirical contextuality evidence",
      "current_artifact": "output/data/general_measurement_cover_polytope_audit.json",
      "current_schema": "schemas/general_measurement_cover_polytope_audit.schema.json",
      "current_validation_gate": "general_measurement_cover_polytope_audit_ok",
      "has_artifact": true,
      "has_negative_control": true,
      "has_schema": true,
      "has_validator": true,
      "id": "general_measurement_cover_polytope_audit",
      "manuscript_claim_allowed": true,
      "readiness_score": 1.0,
      "readiness_state": "validated_finite_simulation",
      "required_negative_control": "triangle and CHSH feasible controls must fit while parity and Bell obstruction cases fail",
      "required_next_artifact": "output/data/reviewed_measurement_cover_library_audit.json",
      "required_next_gate": "reviewed_measurement_cover_library_audit_ok",
      "roadmap_class": "implemented"
    },
    {
      "boundary": "local-basis entropy invariance only; not relativistic or quantum-reference-frame covariance",
      "current_artifact": "output/data/quantum_boundary_entropy.json",
      "current_schema": "schemas/quantum_boundary_entropy.schema.json",
      "current_validation_gate": "quantum_boundary_entropy_ok",
      "has_artifact": true,
      "has_negative_control": true,
      "has_schema": true,
      "has_validator": true,
      "id": "qrf_basis_invariance_toy",
      "manuscript_claim_allowed": true,
      "readiness_score": 1.0,
      "readiness_state": "validated_finite_simulation",
      "required_negative_control": "local rotations preserve reduced entropy while changing measurement entropy",
      "required_next_artifact": "output/data/reviewed_qrf_basis_covariance_audit.json",
      "required_next_gate": "reviewed_qrf_basis_covariance_audit_ok",
      "roadmap_class": "implemented"
    },
    {
      "boundary": "information-erasure lower bound in kBT units, not a measured heat dissipation experiment",
      "current_artifact": "output/data/quantum_boundary_entropy.json",
      "current_schema": "schemas/quantum_boundary_entropy.schema.json",
      "current_validation_gate": "quantum_boundary_entropy_ok",
      "has_artifact": true,
      "has_negative_control": true,
      "has_schema": true,
      "has_validator": true,
      "id": "boundary_landauer_entropy",
      "manuscript_claim_allowed": true,
      "readiness_score": 1.0,
      "readiness_state": "validated_finite_simulation",
      "required_negative_control": "erasure lower bound remains a computational-basis bound, not measured heat",
      "required_next_artifact": "output/data/physical_thermodynamic_cost_audit.json",
      "required_next_gate": "physical_thermodynamic_cost_audit_ok",
      "roadmap_class": "implemented"
    },
    {
      "boundary": "finite CPTP-channel entropy-cost audit only, not measured heat or physical qFEP thermodynamics",
      "current_artifact": "output/data/thermodynamic_channel_cost_audit.json",
      "current_schema": "schemas/thermodynamic_channel_cost_audit.schema.json",
      "current_validation_gate": "thermodynamic_channel_cost_audit_ok",
      "has_artifact": true,
      "has_negative_control": true,
      "has_schema": true,
      "has_validator": true,
      "id": "thermodynamic_channel_cost_audit",
      "manuscript_claim_allowed": true,
      "readiness_score": 1.0,
      "readiness_state": "validated_finite_simulation",
      "required_negative_control": "non-CPTP maps must be rejected before Landauer-cost interpretation",
      "required_next_artifact": "output/data/heat_bath_channel_cost_audit.json",
      "required_next_gate": "heat_bath_channel_cost_audit_ok",
      "roadmap_class": "implemented"
    },
    {
      "boundary": "trace-preserving two-qubit dephasing channel only, not the source paper's full qFEP dynamics",
      "current_artifact": "output/data/quantum_open_system_dynamics.json",
      "current_schema": "schemas/quantum_open_system_dynamics.schema.json",
      "current_validation_gate": "quantum_open_system_dynamics_ok",
      "has_artifact": true,
      "has_negative_control": true,
      "has_schema": true,
      "has_validator": true,
      "id": "two_qubit_dephasing_channel",
      "manuscript_claim_allowed": true,
      "readiness_score": 1.0,
      "readiness_state": "validated_finite_simulation",
      "required_negative_control": "product state remains stable while Bell-state CHSH decays under dephasing",